{
  "table_version": "rev1.3",
  "checksum": "sha256:b54e0456aeb03d2fde289f7125e61d6eb0d5f75ffac97eb522c65bff24d37290",
  "relays": [
    1,
    2,
    3,
    4,
    5,
    6,
    7,
    8,
    9,
    10,
    11,
    12,
    13,
    14,
    15,
    16,
    17,
    18,
    19,
    20,
    21,
    22,
    23,
    24,
    25,
    26,
    27,
    28,
    29,
    30,
    31,
    32,
    33,
    34,
    35,
    36,
    37,
    38,
    39,
    40,
    41,
    42,
    43,
    44,
    45,
    46,
    47,
    48,
    49,
    50,
    51,
    52,
    53,
    54,
    55,
    56,
    57,
    58,
    59,
    60,
    61,
    62,
    63,
    64,
    65,
    66,
    67,
    68,
    69,
    70,
    71,
    72,
    73,
    74,
    75,
    76
  ],
  "groups": [
    {
      "name": "V__V1_1__V1_2",
      "relays": [
        1,
        2
      ]
    },
    {
      "name": "V__V1_1__V1_3",
      "relays": [
        1,
        3
      ]
    },
    {
      "name": "V__V1_1__V1_4",
      "relays": [
        1,
        4
      ]
    },
    {
      "name": "V__V1_1__V1_5",
      "relays": [
        1,
        5
      ]
    },
    {
      "name": "V__V1_1__V1_6",
      "relays": [
        1,
        6
      ]
    },
    {
      "name": "V__V1_1__V1_7",
      "relays": [
        1,
        7
      ]
    },
    {
      "name": "V__V1_1__V1_8",
      "relays": [
        1,
        8
      ]
    },
    {
      "name": "V__V1_1__V2_1",
      "relays": [
        1,
        9
      ]
    },
    {
      "name": "V__V1_1__V2_2",
      "relays": [
        1,
        10
      ]
    },
    {
      "name": "V__V1_1__V2_3",
      "relays": [
        1,
        11
      ]
    },
    {
      "name": "V__V1_1__V2_4",
      "relays": [
        1,
        12
      ]
    },
    {
      "name": "V__V1_1__V2_5",
      "relays": [
        1,
        13
      ]
    },
    {
      "name": "V__V1_1__V2_6",
      "relays": [
        1,
        14
      ]
    },
    {
      "name": "V__V1_1__V2_7",
      "relays": [
        1,
        15
      ]
    },
    {
      "name": "V__V1_1__V3_1",
      "relays": [
        1,
        16
      ]
    },
    {
      "name": "V__V1_1__V3_2",
      "relays": [
        1,
        17
      ]
    },
    {
      "name": "V__V1_1__V3_3",
      "relays": [
        1,
        18
      ]
    },
    {
      "name": "V__V1_1__V3_4",
      "relays": [
        1,
        19
      ]
    },
    {
      "name": "V__V1_1__V3_5",
      "relays": [
        1,
        20
      ]
    },
    {
      "name": "V__V1_1__V3_6",
      "relays": [
        1,
        21
      ]
    },
    {
      "name": "V__V1_1__V3_7",
      "relays": [
        1,
        22
      ]
    },
    {
      "name": "V__V1_1__V3_8",
      "relays": [
        1,
        23
      ]
    },
    {
      "name": "V__V1_1__V3_9",
      "relays": [
        1,
        24
      ]
    },
    {
      "name": "V__V1_1__V3_10",
      "relays": [
        1,
        25
      ]
    },
    {
      "name": "V__V1_1__V4_1",
      "relays": [
        1,
        26
      ]
    },
    {
      "name": "V__V1_1__V4_2",
      "relays": [
        1,
        27
      ]
    },
    {
      "name": "V__V1_1__V4_3",
      "relays": [
        1,
        28
      ]
    },
    {
      "name": "V__V1_1__V4_4",
      "relays": [
        1,
        29
      ]
    },
    {
      "name": "V__V1_2__V1_3",
      "relays": [
        2,
        3
      ]
    },
    {
      "name": "V__V1_2__V1_4",
      "relays": [
        2,
        4
      ]
    },
    {
      "name": "V__V1_2__V1_5",
      "relays": [
        2,
        5
      ]
    },
    {
      "name": "V__V1_2__V1_6",
      "relays": [
        2,
        6
      ]
    },
    {
      "name": "V__V1_2__V1_7",
      "relays": [
        2,
        7
      ]
    },
    {
      "name": "V__V1_2__V1_8",
      "relays": [
        2,
        8
      ]
    },
    {
      "name": "V__V1_2__V2_1",
      "relays": [
        2,
        9
      ]
    },
    {
      "name": "V__V1_2__V2_2",
      "relays": [
        2,
        10
      ]
    },
    {
      "name": "V__V1_2__V2_3",
      "relays": [
        2,
        11
      ]
    },
    {
      "name": "V__V1_2__V2_4",
      "relays": [
        2,
        12
      ]
    },
    {
      "name": "V__V1_2__V2_5",
      "relays": [
        2,
        13
      ]
    },
    {
      "name": "V__V1_2__V2_6",
      "relays": [
        2,
        14
      ]
    },
    {
      "name": "V__V1_2__V2_7",
      "relays": [
        2,
        15
      ]
    },
    {
      "name": "V__V1_2__V3_1",
      "relays": [
        2,
        16
      ]
    },
    {
      "name": "V__V1_2__V3_2",
      "relays": [
        2,
        17
      ]
    },
    {
      "name": "V__V1_2__V3_3",
      "relays": [
        2,
        18
      ]
    },
    {
      "name": "V__V1_2__V3_4",
      "relays": [
        2,
        19
      ]
    },
    {
      "name": "V__V1_2__V3_5",
      "relays": [
        2,
        20
      ]
    },
    {
      "name": "V__V1_2__V3_6",
      "relays": [
        2,
        21
      ]
    },
    {
      "name": "V__V1_2__V3_7",
      "relays": [
        2,
        22
      ]
    },
    {
      "name": "V__V1_2__V3_8",
      "relays": [
        2,
        23
      ]
    },
    {
      "name": "V__V1_2__V3_9",
      "relays": [
        2,
        24
      ]
    },
    {
      "name": "V__V1_2__V3_10",
      "relays": [
        2,
        25
      ]
    },
    {
      "name": "V__V1_2__V4_1",
      "relays": [
        2,
        26
      ]
    },
    {
      "name": "V__V1_2__V4_2",
      "relays": [
        2,
        27
      ]
    },
    {
      "name": "V__V1_2__V4_3",
      "relays": [
        2,
        28
      ]
    },
    {
      "name": "V__V1_2__V4_4",
      "relays": [
        2,
        29
      ]
    },
    {
      "name": "V__V1_3__V1_4",
      "relays": [
        3,
        4
      ]
    },
    {
      "name": "V__V1_3__V1_5",
      "relays": [
        3,
        5
      ]
    },
    {
      "name": "V__V1_3__V1_6",
      "relays": [
        3,
        6
      ]
    },
    {
      "name": "V__V1_3__V1_7",
      "relays": [
        3,
        7
      ]
    },
    {
      "name": "V__V1_3__V1_8",
      "relays": [
        3,
        8
      ]
    },
    {
      "name": "V__V1_3__V2_1",
      "relays": [
        3,
        9
      ]
    },
    {
      "name": "V__V1_3__V2_2",
      "relays": [
        3,
        10
      ]
    },
    {
      "name": "V__V1_3__V2_3",
      "relays": [
        3,
        11
      ]
    },
    {
      "name": "V__V1_3__V2_4",
      "relays": [
        3,
        12
      ]
    },
    {
      "name": "V__V1_3__V2_5",
      "relays": [
        3,
        13
      ]
    },
    {
      "name": "V__V1_3__V2_6",
      "relays": [
        3,
        14
      ]
    },
    {
      "name": "V__V1_3__V2_7",
      "relays": [
        3,
        15
      ]
    },
    {
      "name": "V__V1_3__V3_1",
      "relays": [
        3,
        16
      ]
    },
    {
      "name": "V__V1_3__V3_2",
      "relays": [
        3,
        17
      ]
    },
    {
      "name": "V__V1_3__V3_3",
      "relays": [
        3,
        18
      ]
    },
    {
      "name": "V__V1_3__V3_4",
      "relays": [
        3,
        19
      ]
    },
    {
      "name": "V__V1_3__V3_5",
      "relays": [
        3,
        20
      ]
    },
    {
      "name": "V__V1_3__V3_6",
      "relays": [
        3,
        21
      ]
    },
    {
      "name": "V__V1_3__V3_7",
      "relays": [
        3,
        22
      ]
    },
    {
      "name": "V__V1_3__V3_8",
      "relays": [
        3,
        23
      ]
    },
    {
      "name": "V__V1_3__V3_9",
      "relays": [
        3,
        24
      ]
    },
    {
      "name": "V__V1_3__V3_10",
      "relays": [
        3,
        25
      ]
    },
    {
      "name": "V__V1_3__V4_1",
      "relays": [
        3,
        26
      ]
    },
    {
      "name": "V__V1_3__V4_2",
      "relays": [
        3,
        27
      ]
    },
    {
      "name": "V__V1_3__V4_3",
      "relays": [
        3,
        28
      ]
    },
    {
      "name": "V__V1_3__V4_4",
      "relays": [
        3,
        29
      ]
    },
    {
      "name": "V__V1_4__V1_5",
      "relays": [
        4,
        5
      ]
    },
    {
      "name": "V__V1_4__V1_6",
      "relays": [
        4,
        6
      ]
    },
    {
      "name": "V__V1_4__V1_7",
      "relays": [
        4,
        7
      ]
    },
    {
      "name": "V__V1_4__V1_8",
      "relays": [
        4,
        8
      ]
    },
    {
      "name": "V__V1_4__V2_1",
      "relays": [
        4,
        9
      ]
    },
    {
      "name": "V__V1_4__V2_2",
      "relays": [
        4,
        10
      ]
    },
    {
      "name": "V__V1_4__V2_3",
      "relays": [
        4,
        11
      ]
    },
    {
      "name": "V__V1_4__V2_4",
      "relays": [
        4,
        12
      ]
    },
    {
      "name": "V__V1_4__V2_5",
      "relays": [
        4,
        13
      ]
    },
    {
      "name": "V__V1_4__V2_6",
      "relays": [
        4,
        14
      ]
    },
    {
      "name": "V__V1_4__V2_7",
      "relays": [
        4,
        15
      ]
    },
    {
      "name": "V__V1_4__V3_1",
      "relays": [
        4,
        16
      ]
    },
    {
      "name": "V__V1_4__V3_2",
      "relays": [
        4,
        17
      ]
    },
    {
      "name": "V__V1_4__V3_3",
      "relays": [
        4,
        18
      ]
    },
    {
      "name": "V__V1_4__V3_4",
      "relays": [
        4,
        19
      ]
    },
    {
      "name": "V__V1_4__V3_5",
      "relays": [
        4,
        20
      ]
    },
    {
      "name": "V__V1_4__V3_6",
      "relays": [
        4,
        21
      ]
    },
    {
      "name": "V__V1_4__V3_7",
      "relays": [
        4,
        22
      ]
    },
    {
      "name": "V__V1_4__V3_8",
      "relays": [
        4,
        23
      ]
    },
    {
      "name": "V__V1_4__V3_9",
      "relays": [
        4,